bioguide_id,name,wikipedia_linkA000055,"Rep. Robert B. Aderholt (R, AL-4)",http://en.wikipedia.org/wiki/Robert_AderholtA000361,"Rep. Rodney Alexander (R, LA-5)",http://en.wikipedia.org/wiki/Rodney_AlexanderA000210,"Rep. Robert E. Andrews (D, NJ-1)",http://en.wikipedia.org/wiki/Rob_AndrewsB000013,"Rep. Spencer Bachus (R, AL-6)",http://en.wikipedia.org/wiki/Spencer_BachusB001230,"Sen. Tammy Baldwin (D, WI)",http://en.wikipedia.org/wiki/Tammy_BaldwinB000213,"Rep. Joe Barton (R, TX-6)",http://en.wikipedia.org/wiki/Joe_BartonB000287,"Rep. Xavier Becerra (D, CA-34)",http://en.wikipedia.org/wiki/Xavier_BecerraB000490,"Rep. Sanford D. Bishop Jr. (D, GA-2)",http://en.wikipedia.org/wiki/Sanford_BishopB001242,"Rep. Timothy H. Bishop (D, NY-1)",http://en.wikipedia.org/wiki/Tim_BishopB001250,"Rep. Rob Bishop (R, UT-1)",http://en.wikipedia.org/wiki/Rob_BishopB001243,"Rep. Marsha Blackburn (R, TN-7)",http://en.wikipedia.org/wiki/Marsha_BlackburnB000574,"Rep. Earl Blumenauer (D, OR-3)",http://en.wikipedia.org/wiki/Earl_BlumenauerB000575,"Sen. Roy Blunt (R, MO)",http://en.wikipedia.org/wiki/Roy_BluntB000589,"Rep. John A. Boehner (R, OH-8)",http://en.wikipedia.org/wiki/John_BoehnerB001244,"Rep. Jo Bonner (R, AL-1)",http://en.wikipedia.org/wiki/Jo_BonnerB001236,"Sen. John Boozman (R, AR)",http://en.wikipedia.org/wiki/John_BoozmanB001245,"Del. Madeleine Z. Bordallo (D, GU-0)",http://en.wikipedia.org/wiki/Madeleine_BordalloB001227,"Rep. Robert A. Brady (D, PA-1)",http://en.wikipedia.org/wiki/Bob_BradyB000755,"Rep. Kevin Brady (R, TX-8)",http://en.wikipedia.org/wiki/Kevin_BradyB000911,"Rep. Corrine Brown (D, FL-5)",http://en.wikipedia.org/wiki/Corrine_BrownB000944,"Sen. Sherrod Brown (D, OH)",http://en.wikipedia.org/wiki/Sherrod_BrownB001248,"Rep. Michael C. Burgess (R, TX-26)",http://en.wikipedia.org/wiki/Michael_C._BurgessB001135,"Sen. Richard Burr (R, NC)",http://en.wikipedia.org/wiki/Richard_BurrC000059,"Rep. Ken Calvert (R, CA-42)",http://en.wikipedia.org/wiki/Ken_CalvertC000071,"Rep. Dave Camp (R, MI-4)",http://en.wikipedia.org/wiki/Dave_CampC001046,"Rep. Eric Cantor (R, VA-7)",http://en.wikipedia.org/wiki/Eric_CantorC001047,"Rep. Shelley Moore Capito (R, WV-2)",http://en.wikipedia.org/wiki/Shelley_Moore_CapitoC001036,"Rep. Lois Capps (D, CA-24)",http://en.wikipedia.org/wiki/Lois_CappsC001037,"Rep. Michael E. Capuano (D, MA-7)",http://en.wikipedia.org/wiki/Mike_CapuanoC000141,"Sen. Benjamin L. Cardin (D, MD)",http://en.wikipedia.org/wiki/Ben_CardinC001051,"Rep. John R. Carter (R, TX-31)",http://en.wikipedia.org/wiki/John_Carter_(Texas)C000266,"Rep. Steve Chabot (R, OH-1)",http://en.wikipedia.org/wiki/Steve_ChabotC000380,"Del. Donna M. Christensen (D, VI-0)",http://en.wikipedia.org/wiki/Donna_Christian-ChristensenC001049,"Rep. Wm. Lacy Clay (D, MO-1)","http://en.wikipedia.org/wiki/William_Lacy_Clay,_Jr."C000537,"Rep. James E. Clyburn (D, SC-6)",http://en.wikipedia.org/wiki/Jim_ClyburnC000556,"Rep. Howard Coble (R, NC-6)",http://en.wikipedia.org/wiki/Howard_CobleC001053,"Rep. Tom Cole (R, OK-4)",http://en.wikipedia.org/wiki/Tom_ColeC000714,"Rep. John Conyers Jr. (D, MI-13)",http://en.wikipedia.org/wiki/John_ConyersC000754,"Rep. Jim Cooper (D, TN-5)",http://en.wikipedia.org/wiki/Jim_CooperC001045,"Rep. Ander Crenshaw (R, FL-4)",http://en.wikipedia.org/wiki/Ander_CrenshawC001038,"Rep. Joseph Crowley (D, NY-14)",http://en.wikipedia.org/wiki/Joseph_CrowleyC001048,"Rep. John Abney Culberson (R, TX-7)",http://en.wikipedia.org/wiki/John_CulbersonC000984,"Rep. Elijah E. Cummings (D, MD-7)",http://en.wikipedia.org/wiki/Elijah_CummingsD000598,"Rep. Susan A. Davis (D, CA-53)",http://en.wikipedia.org/wiki/Susan_Davis_(politician)D000096,"Rep. Danny K. Davis (D, IL-7)",http://en.wikipedia.org/wiki/Danny_K._DavisD000191,"Rep. Peter A. DeFazio (D, OR-4)",http://en.wikipedia.org/wiki/Peter_DeFazioD000197,"Rep. Diana DeGette (D, CO-1)",http://en.wikipedia.org/wiki/Diana_DeGetteD000216,"Rep. Rosa L. DeLauro (D, CT-3)",http://en.wikipedia.org/wiki/Rosa_DeLauroD000600,"Rep. Mario Diaz-Balart (R, FL-25)",http://en.wikipedia.org/wiki/Mario_Diaz-BalartD000355,"Rep. John D. Dingell (D, MI-12)",http://en.wikipedia.org/wiki/John_DingellD000399,"Rep. Lloyd Doggett (D, TX-35)",http://en.wikipedia.org/wiki/Lloyd_DoggettD000482,"Rep. Michael F. Doyle (D, PA-14)",http://en.wikipedia.org/wiki/Michael_F._DoyleD000533,"Rep. John J. Duncan Jr. (R, TN-2)",http://en.wikipedia.org/wiki/Jimmy_Duncan_(U.S._politician)E000172,"Rep. Jo Ann Emerson (R, MO-8)",http://en.wikipedia.org/wiki/Jo_Ann_EmersonE000179,"Rep. Eliot L. Engel (D, NY-16)",http://en.wikipedia.org/wiki/Eliot_EngelE000215,"Rep. Anna G. Eshoo (D, CA-18)",http://en.wikipedia.org/wiki/Anna_EshooF000010,"Del. Eni F. H. Faleomavaega (D, AS-0)",http://en.wikipedia.org/wiki/Eni_FaleomavaegaF000030,"Rep. Sam Farr (D, CA-20)",http://en.wikipedia.org/wiki/Sam_FarrF000043,"Rep. Chaka Fattah (D, PA-2)",http://en.wikipedia.org/wiki/Chaka_FattahF000444,"Sen. Jeff Flake (R, AZ)",http://en.wikipedia.org/wiki/Jeff_FlakeF000445,"Rep. J. Randy Forbes (R, VA-4)",http://en.wikipedia.org/wiki/Randy_ForbesF000448,"Rep. Trent Franks (R, AZ-8)",http://en.wikipedia.org/wiki/Trent_FranksF000372,"Rep. Rodney P. Frelinghuysen (R, NJ-11)",http://en.wikipedia.org/wiki/Rodney_FrelinghuysenG000548,"Rep. Scott Garrett (R, NJ-5)",http://en.wikipedia.org/wiki/Scott_GarrettG000549,"Rep. Jim Gerlach (R, PA-6)",http://en.wikipedia.org/wiki/Jim_GerlachG000550,"Rep. Phil Gingrey (R, GA-11)",http://en.wikipedia.org/wiki/Phil_GingreyG000289,"Rep. Bob Goodlatte (R, VA-6)",http://en.wikipedia.org/wiki/Bob_GoodlatteG000377,"Rep. Kay Granger (R, TX-12)",http://en.wikipedia.org/wiki/Kay_GrangerG000546,"Rep. Sam Graves (R, MO-6)",http://en.wikipedia.org/wiki/Sam_GravesG000410,"Rep. Gene Green (D, TX-29)",http://en.wikipedia.org/wiki/Gene_GreenG000551,"Rep. Raúl M. Grijalva (D, AZ-3)",http://en.wikipedia.org/wiki/Ra%C3%BAl_GrijalvaG000535,"Rep. Luis V. Gutierrez (D, IL-4)",http://en.wikipedia.org/wiki/Luis_Guti%C3%A9rrezH000067,"Rep. Ralph M. Hall (R, TX-4)",http://en.wikipedia.org/wiki/Ralph_HallH000324,"Rep. Alcee L. Hastings (D, FL-20)",http://en.wikipedia.org/wiki/Alcee_HastingsH000329,"Rep. Doc Hastings (R, WA-4)",http://en.wikipedia.org/wiki/Doc_HastingsH001036,"Rep. Jeb Hensarling (R, TX-5)",http://en.wikipedia.org/wiki/Jeb_HensarlingH000636,"Rep. Rubén Hinojosa (D, TX-15)",http://en.wikipedia.org/wiki/Rub%C3%A9n_HinojosaH001032,"Rep. Rush D. Holt (D, NJ-12)","http://en.wikipedia.org/wiki/Rush_D._Holt,_Jr."H001034,"Rep. Michael M. Honda (D, CA-17)",http://en.wikipedia.org/wiki/Mike_HondaH000874,"Rep. Steny H. Hoyer (D, MD-5)",http://en.wikipedia.org/wiki/Steny_HoyerI000055,"Sen. Johnny Isakson (R, GA)",http://en.wikipedia.org/wiki/Johnny_IsaksonI000057,"Rep. Steve Israel (D, NY-3)",http://en.wikipedia.org/wiki/Steve_IsraelI000056,"Rep. Darrell E. Issa (R, CA-49)",http://en.wikipedia.org/wiki/Darrell_IssaJ000174,"Rep. Sam Johnson (R, TX-3)",http://en.wikipedia.org/wiki/Sam_JohnsonJ000126,"Rep. Eddie Bernice Johnson (D, TX-30)",http://en.wikipedia.org/wiki/Eddie_Bernice_JohnsonJ000255,"Rep. Walter B. Jones (R, NC-3)","http://en.wikipedia.org/wiki/Walter_B._Jones,_Jr."K000009,"Rep. Marcy Kaptur (D, OH-9)",http://en.wikipedia.org/wiki/Marcy_KapturK000188,"Rep. Ron Kind (D, WI-3)",http://en.wikipedia.org/wiki/Ron_KindK000362,"Rep. Steve King (R, IA-4)",http://en.wikipedia.org/wiki/Steve_KingK000210,"Rep. Peter T. King (R, NY-2)",http://en.wikipedia.org/wiki/Peter_T._KingK000220,"Rep. Jack Kingston (R, GA-1)",http://en.wikipedia.org/wiki/Jack_KingstonK000360,"Sen. Mark Kirk (R, IL)",http://en.wikipedia.org/wiki/Mark_KirkK000363,"Rep. John Kline (R, MN-2)",http://en.wikipedia.org/wiki/John_Kline_(politician)L000559,"Rep. James R. Langevin (D, RI-2)",http://en.wikipedia.org/wiki/James_LangevinL000560,"Rep. Rick Larsen (D, WA-2)",http://en.wikipedia.org/wiki/Rick_LarsenL000557,"Rep. John B. Larson (D, CT-1)",http://en.wikipedia.org/wiki/John_B._LarsonL000111,"Rep. Tom Latham (R, IA-3)",http://en.wikipedia.org/wiki/Tom_LathamL000551,"Rep. Barbara Lee (D, CA-13)",http://en.wikipedia.org/wiki/Barbara_LeeJ000032,"Rep. Sheila Jackson Lee (D, TX-18)",http://en.wikipedia.org/wiki/Sheila_Jackson_LeeL000263,"Rep. Sander M. Levin (D, MI-9)",http://en.wikipedia.org/wiki/Sander_M._LevinL000287,"Rep. John Lewis (D, GA-5)",http://en.wikipedia.org/wiki/John_Lewis_(U.S._politician)L000554,"Rep. Frank A. LoBiondo (R, NJ-2)",http://en.wikipedia.org/wiki/Frank_LoBiondoL000397,"Rep. Zoe Lofgren (D, CA-19)",http://en.wikipedia.org/wiki/Zoe_LofgrenL000480,"Rep. Nita M. Lowey (D, NY-17)",http://en.wikipedia.org/wiki/Nita_LoweyL000491,"Rep. Frank D. Lucas (R, OK-3)",http://en.wikipedia.org/wiki/Frank_Lucas_(Oklahoma)L000562,"Rep. Stephen F. Lynch (D, MA-8)",http://en.wikipedia.org/wiki/Stephen_Lynch_(politician)M000087,"Rep. Carolyn B. Maloney (D, NY-12)",http://en.wikipedia.org/wiki/Carolyn_MaloneyM000133,"Rep. Edward J. Markey (D, MA-5)",http://en.wikipedia.org/wiki/Ed_MarkeyM001142,"Rep. Jim Matheson (D, UT-4)",http://en.wikipedia.org/wiki/Jim_MathesonM000309,"Rep. Carolyn McCarthy (D, NY-4)",http://en.wikipedia.org/wiki/Carolyn_McCarthyM001143,"Rep. Betty McCollum (D, MN-4)",http://en.wikipedia.org/wiki/Betty_McCollumM000404,"Rep. Jim McDermott (D, WA-7)",http://en.wikipedia.org/wiki/Jim_McDermottM000312,"Rep. James P. McGovern (D, MA-2)",http://en.wikipedia.org/wiki/Jim_McGovern_(American_politician)M000485,"Rep. Mike McIntyre (D, NC-7)",http://en.wikipedia.org/wiki/Mike_McIntyreM000508,"Rep. Howard P. ""Buck"" McKeon (R, CA-25)",http://en.wikipedia.org/wiki/Howard_McKeonM001137,"Rep. Gregory W. Meeks (D, NY-5)",http://en.wikipedia.org/wiki/Gregory_MeeksM000639,"Sen. Robert Menendez (D, NJ)",http://en.wikipedia.org/wiki/Bob_MenendezM000689,"Rep. John L. Mica (R, FL-7)",http://en.wikipedia.org/wiki/John_MicaM001149,"Rep. Michael H. Michaud (D, ME-2)",http://en.wikipedia.org/wiki/Mike_MichaudM001150,"Rep. Candice S. Miller (R, MI-10)",http://en.wikipedia.org/wiki/Candice_MillerM001139,"Rep. Gary G. Miller (R, CA-31)",http://en.wikipedia.org/wiki/Gary_MillerM000725,"Rep. George Miller (D, CA-11)",http://en.wikipedia.org/wiki/George_Miller_(California_politician)M001144,"Rep. Jeff Miller (R, FL-1)",http://en.wikipedia.org/wiki/Jeff_Miller_(Florida_politician)M000934,"Sen. Jerry Moran (R, KS)",http://en.wikipedia.org/wiki/Jerry_MoranM000933,"Rep. James P. Moran (D, VA-8)",http://en.wikipedia.org/wiki/Jim_MoranM001151,"Rep. Tim Murphy (R, PA-18)",http://en.wikipedia.org/wiki/Timothy_F._MurphyN000002,"Rep. Jerrold Nadler (D, NY-10)",http://en.wikipedia.org/wiki/Jerrold_NadlerN000179,"Rep. Grace F. Napolitano (D, CA-32)",http://en.wikipedia.org/wiki/Grace_NapolitanoN000015,"Rep. Richard E. Neal (D, MA-1)",http://en.wikipedia.org/wiki/Richard_NealN000147,"Del. Eleanor Holmes Norton (D, DC-0)",http://en.wikipedia.org/wiki/Eleanor_Holmes_NortonN000181,"Rep. Devin Nunes (R, CA-22)",http://en.wikipedia.org/wiki/Devin_NunesP000034,"Rep. Frank Pallone Jr. (D, NJ-6)",http://en.wikipedia.org/wiki/Frank_PalloneP000096,"Rep. Bill Pascrell Jr. (D, NJ-9)",http://en.wikipedia.org/wiki/Bill_PascrellP000099,"Rep. Ed Pastor (D, AZ-7)",http://en.wikipedia.org/wiki/Ed_PastorP000588,"Rep. Stevan Pearce (R, NM-2)",http://en.wikipedia.org/wiki/Steve_Pearce_(politician)P000197,"Rep. Nancy Pelosi (D, CA-12)",http://en.wikipedia.org/wiki/Nancy_PelosiP000258,"Rep. Collin C. Peterson (D, MN-7)",http://en.wikipedia.org/wiki/Collin_PetersonP000265,"Rep. Thomas E. Petri (R, WI-6)",http://en.wikipedia.org/wiki/Tom_PetriP000373,"Rep. Joseph R. Pitts (R, PA-16)",http://en.wikipedia.org/wiki/Joseph_R._PittsP000449,"Sen. Rob Portman (R, OH)",http://en.wikipedia.org/wiki/Rob_PortmanP000523,"Rep. David E. Price (D, NC-4)",http://en.wikipedia.org/wiki/David_Price_(U.S._politician)R000011,"Rep. Nick J. Rahall II (D, WV-3)",http://en.wikipedia.org/wiki/Nick_RahallR000053,"Rep. Charles B. Rangel (D, NY-13)",http://en.wikipedia.org/wiki/Charles_B._RangelR000575,"Rep. Mike Rogers (R, AL-3)",http://en.wikipedia.org/wiki/Mike_D._RogersR000395,"Rep. Harold Rogers (R, KY-5)",http://en.wikipedia.org/wiki/Hal_RogersR000572,"Rep. Mike Rogers (R, MI-8)",http://en.wikipedia.org/wiki/Mike_Rogers_(Michigan_politician)R000409,"Rep. Dana Rohrabacher (R, CA-48)",http://en.wikipedia.org/wiki/Dana_RohrabacherR000435,"Rep. Ileana Ros-Lehtinen (R, FL-27)",http://en.wikipedia.org/wiki/Ileana_Ros-LehtinenR000486,"Rep. Lucille Roybal-Allard (D, CA-40)",http://en.wikipedia.org/wiki/Lucille_Roybal-AllardR000487,"Rep. Edward R. Royce (R, CA-39)",http://en.wikipedia.org/wiki/Ed_RoyceR000576,"Rep. C. A. Dutch Ruppersberger (D, MD-2)",http://en.wikipedia.org/wiki/Dutch_RuppersbergerR000515,"Rep. Bobby L. Rush (D, IL-1)",http://en.wikipedia.org/wiki/Bobby_RushR000577,"Rep. Tim Ryan (D, OH-13)",http://en.wikipedia.org/wiki/Tim_Ryan_(politician)R000570,"Rep. Paul Ryan (R, WI-1)",http://en.wikipedia.org/wiki/Paul_RyanS001156,"Rep. Linda T. Sánchez (D, CA-38)",http://en.wikipedia.org/wiki/Linda_S%C3%A1nchezS000030,"Rep. Loretta Sanchez (D, CA-46)",http://en.wikipedia.org/wiki/Loretta_SanchezS000033,"Sen. Bernard Sanders (I, VT)",http://en.wikipedia.org/wiki/Bernie_SandersS001145,"Rep. Janice D. Schakowsky (D, IL-9)",http://en.wikipedia.org/wiki/Jan_SchakowskyS001150,"Rep. Adam B. Schiff (D, CA-28)",http://en.wikipedia.org/wiki/Adam_SchiffS001157,"Rep. David Scott (D, GA-13)",http://en.wikipedia.org/wiki/David_Scott_(Georgia_politician)S000185,"Rep. Robert C. ""Bobby"" Scott (D, VA-3)",http://en.wikipedia.org/wiki/Bobby_Scott_(U.S._politician)S000244,"Rep. F. James Sensenbrenner Jr. (R, WI-5)",http://en.wikipedia.org/wiki/Jim_SensenbrennerS000248,"Rep. José E. Serrano (D, NY-15)",http://en.wikipedia.org/wiki/Jos%C3%A9_Serrano_(politician)S000250,"Rep. Pete Sessions (R, TX-32)",http://en.wikipedia.org/wiki/Pete_SessionsS000344,"Rep. Brad Sherman (D, CA-30)",http://en.wikipedia.org/wiki/Brad_ShermanS000364,"Rep. John Shimkus (R, IL-15)",http://en.wikipedia.org/wiki/John_ShimkusS001148,"Rep. Michael K. Simpson (R, ID-2)",http://en.wikipedia.org/wiki/Mike_SimpsonS000480,"Rep. Louise McIntosh Slaughter (D, NY-25)",http://en.wikipedia.org/wiki/Louise_SlaughterS000522,"Rep. Christopher H. Smith (R, NJ-4)",http://en.wikipedia.org/wiki/Chris_Smith_(New_Jersey_politician)S000583,"Rep. Lamar Smith (R, TX-21)",http://en.wikipedia.org/wiki/Lamar_S._SmithS000510,"Rep. Adam Smith (D, WA-9)",http://en.wikipedia.org/wiki/Adam_Smith_(politician)T000459,"Rep. Lee Terry (R, NE-2)",http://en.wikipedia.org/wiki/Lee_TerryT000460,"Rep. Mike Thompson (D, CA-5)",http://en.wikipedia.org/wiki/Mike_Thompson_(California_politician)T000193,"Rep. Bennie G. Thompson (D, MS-2)",http://en.wikipedia.org/wiki/Bennie_ThompsonT000238,"Rep. Mac Thornberry (R, TX-13)",http://en.wikipedia.org/wiki/Mac_ThornberryT000462,"Rep. Patrick J. Tiberi (R, OH-12)",http://en.wikipedia.org/wiki/Pat_TiberiT000266,"Rep. John F. Tierney (D, MA-6)",http://en.wikipedia.org/wiki/John_F._TierneyT000461,"Sen. Patrick J. Toomey (R, PA)",http://en.wikipedia.org/wiki/Pat_ToomeyT000463,"Rep. Michael R. Turner (R, OH-10)",http://en.wikipedia.org/wiki/Mike_TurnerU000038,"Sen. Mark Udall (D, CO)",http://en.wikipedia.org/wiki/Mark_UdallU000039,"Sen. Tom Udall (D, NM)",http://en.wikipedia.org/wiki/Tom_UdallU000031,"Rep. Fred Upton (R, MI-6)",http://en.wikipedia.org/wiki/Fred_UptonV000128,"Rep. Chris Van Hollen (D, MD-8)",http://en.wikipedia.org/wiki/Chris_Van_HollenV000081,"Rep. Nydia M. Velázquez (D, NY-7)",http://en.wikipedia.org/wiki/Nydia_Vel%C3%A1zquezV000108,"Rep. Peter J. Visclosky (D, IN-1)",http://en.wikipedia.org/wiki/Pete_ViscloskyV000127,"Sen. David Vitter (R, LA)",http://en.wikipedia.org/wiki/David_VitterW000791,"Rep. Greg Walden (R, OR-2)",http://en.wikipedia.org/wiki/Greg_WaldenW000187,"Rep. Maxine Waters (D, CA-43)",http://en.wikipedia.org/wiki/Maxine_WatersW000207,"Rep. Melvin L. Watt (D, NC-12)",http://en.wikipedia.org/wiki/Mel_WattW000215,"Rep. Henry A. Waxman (D, CA-33)",http://en.wikipedia.org/wiki/Henry_WaxmanW000413,"Rep. Ed Whitfield (R, KY-1)",http://en.wikipedia.org/wiki/Ed_WhitfieldW000437,"Sen. Roger F. Wicker (R, MS)",http://en.wikipedia.org/wiki/Roger_WickerW000795,"Rep. Joe Wilson (R, SC-2)",http://en.wikipedia.org/wiki/Joe_Wilson_(U.S._politician)W000672,"Rep. Frank R. Wolf (R, VA-10)",http://en.wikipedia.org/wiki/Frank_WolfY000031,"Rep. C. W. Bill Young (R, FL-13)",http://en.wikipedia.org/wiki/Bill_YoungY000033,"Rep. Don Young (R, AK-0)",http://en.wikipedia.org/wiki/Don_YoungN000182,"Rep. Randy Neugebauer (R, TX-19)",http://en.wikipedia.org/wiki/Randy_NeugebauerA000360,"Sen. Lamar Alexander (R, TN)",http://en.wikipedia.org/wiki/Lamar_AlexanderB000243,"Sen. Max Baucus (D, MT)",http://en.wikipedia.org/wiki/Max_BaucusB000711,"Sen. Barbara Boxer (D, CA)",http://en.wikipedia.org/wiki/Barbara_BoxerC000127,"Sen. Maria Cantwell (D, WA)",http://en.wikipedia.org/wiki/Maria_CantwellC000174,"Sen. Thomas R. Carper (D, DE)",http://en.wikipedia.org/wiki/Tom_CarperC000286,"Sen. Saxby Chambliss (R, GA)",http://en.wikipedia.org/wiki/Saxby_ChamblissC000567,"Sen. Thad Cochran (R, MS)",http://en.wikipedia.org/wiki/Thad_CochranC001035,"Sen. Susan M. Collins (R, ME)",http://en.wikipedia.org/wiki/Susan_CollinsC001056,"Sen. John Cornyn (R, TX)",http://en.wikipedia.org/wiki/John_CornynC000880,"Sen. Mike Crapo (R, ID)",http://en.wikipedia.org/wiki/Mike_CrapoD000563,"Sen. Richard J. Durbin (D, IL)",http://en.wikipedia.org/wiki/Dick_DurbinE000285,"Sen. Michael B. Enzi (R, WY)",http://en.wikipedia.org/wiki/Mike_EnziF000062,"Sen. Dianne Feinstein (D, CA)",http://en.wikipedia.org/wiki/Dianne_FeinsteinG000359,"Sen. Lindsey Graham (R, SC)",http://en.wikipedia.org/wiki/Lindsey_GrahamG000386,"Sen. Chuck Grassley (R, IA)",http://en.wikipedia.org/wiki/Chuck_GrassleyH000206,"Sen. Tom Harkin (D, IA)",http://en.wikipedia.org/wiki/Tom_HarkinH000338,"Sen. Orrin G. Hatch (R, UT)",http://en.wikipedia.org/wiki/Orrin_HatchI000024,"Sen. James M. Inhofe (R, OK)",http://en.wikipedia.org/wiki/Jim_InhofeJ000177,"Sen. Tim Johnson (D, SD)",http://en.wikipedia.org/wiki/Tim_Johnson_(U.S._Senator)K000148,"Sen. John F. Kerry (D, MA)",http://en.wikipedia.org/wiki/John_KerryL000550,"Sen. Mary L. Landrieu (D, LA)",http://en.wikipedia.org/wiki/Mary_LandrieuL000123,"Sen. Frank R. Lautenberg (D, NJ)",http://en.wikipedia.org/wiki/Frank_LautenbergL000174,"Sen. Patrick J. Leahy (D, VT)",http://en.wikipedia.org/wiki/Patrick_LeahyL000261,"Sen. Carl Levin (D, MI)",http://en.wikipedia.org/wiki/Carl_LevinM000303,"Sen. John McCain (R, AZ)",http://en.wikipedia.org/wiki/John_McCainM000355,"Sen. Mitch McConnell (R, KY)",http://en.wikipedia.org/wiki/Mitch_McConnellM000702,"Sen. Barbara A. Mikulski (D, MD)",http://en.wikipedia.org/wiki/Barbara_MikulskiM001153,"Sen. Lisa Murkowski (R, AK)",http://en.wikipedia.org/wiki/Lisa_MurkowskiM001111,"Sen. Patty Murray (D, WA)",http://en.wikipedia.org/wiki/Patty_MurrayN000032,"Sen. Bill Nelson (D, FL)",http://en.wikipedia.org/wiki/Bill_NelsonP000590,"Sen. Mark L. Pryor (D, AR)",http://en.wikipedia.org/wiki/Mark_PryorR000122,"Sen. Jack Reed (D, RI)",http://en.wikipedia.org/wiki/Jack_Reed_(politician)R000146,"Sen. Harry Reid (D, NV)",http://en.wikipedia.org/wiki/Harry_ReidR000307,"Sen. Pat Roberts (R, KS)",http://en.wikipedia.org/wiki/Pat_RobertsR000361,"Sen. John D. Rockefeller, IV (D, WV)",http://en.wikipedia.org/wiki/Jay_RockefellerS000148,"Sen. Charles E. Schumer (D, NY)",http://en.wikipedia.org/wiki/Chuck_SchumerS001141,"Sen. Jeff Sessions (R, AL)",http://en.wikipedia.org/wiki/Jeff_SessionsS000320,"Sen. Richard C. Shelby (R, AL)",http://en.wikipedia.org/wiki/Richard_ShelbyS000770,"Sen. Debbie Stabenow (D, MI)",http://en.wikipedia.org/wiki/Debbie_StabenowW000779,"Sen. Ron Wyden (D, OR)",http://en.wikipedia.org/wiki/Ron_WydenT000250,"Sen. John Thune (R, SD)",http://en.wikipedia.org/wiki/John_ThuneC000560,"Sen. Tom Coburn (R, OK)",http://en.wikipedia.org/wiki/Tom_CoburnS000018,"Rep. Matt Salmon (R, AZ-5)",http://en.wikipedia.org/wiki/Matt_SalmonB001251,"Rep. G. K. Butterfield (D, NC-1)",http://en.wikipedia.org/wiki/G._K._ButterfieldC001059,"Rep. Jim Costa (D, CA-16)",http://en.wikipedia.org/wiki/Jim_CostaW000797,"Rep. Debbie Wasserman Schultz (D, FL-23)",http://en.wikipedia.org/wiki/Debbie_Wasserman_SchultzP000591,"Rep. Tom Price (R, GA-6)",http://en.wikipedia.org/wiki/Tom_Price_(U.S._politician)W000796,"Rep. Lynn A. Westmoreland (R, GA-3)",http://en.wikipedia.org/wiki/Lynn_WestmorelandB001252,"Rep. John Barrow (D, GA-12)",http://en.wikipedia.org/wiki/John_Barrow_(U.S._politician)O000167,Pres. Barack Obama,http://en.wikipedia.org/wiki/Barack_ObamaL000563,"Rep. Daniel Lipinski (D, IL-3)",http://en.wikipedia.org/wiki/Dan_LipinskiB001255,"Rep. Charles W. Boustany Jr. (R, LA-3)",http://en.wikipedia.org/wiki/Charles_BoustanyC001061,"Rep. Emanuel Cleaver (D, MO-5)",http://en.wikipedia.org/wiki/Emanuel_CleaverF000449,"Rep. Jeff Fortenberry (R, NE-1)",http://en.wikipedia.org/wiki/Jeff_FortenberryH001038,"Rep. Brian Higgins (D, NY-26)",http://en.wikipedia.org/wiki/Brian_HigginsF000450,"Rep. Virginia Foxx (R, NC-5)",http://en.wikipedia.org/wiki/Virginia_FoxxM001156,"Rep. Patrick T. McHenry (R, NC-10)",http://en.wikipedia.org/wiki/Patrick_McHenryF000451,"Rep. Michael G. Fitzpatrick (R, PA-8)",http://en.wikipedia.org/wiki/Mike_FitzpatrickS001162,"Rep. Allyson Y. Schwartz (D, PA-13)",http://en.wikipedia.org/wiki/Allyson_SchwartzD000604,"Rep. Charles W. Dent (R, PA-15)",http://en.wikipedia.org/wiki/Charlie_DentG000552,"Rep. Louie Gohmert (R, TX-1)",http://en.wikipedia.org/wiki/Louie_GohmertP000592,"Rep. Ted Poe (R, TX-2)",http://en.wikipedia.org/wiki/Ted_PoeG000553,"Rep. Al Green (D, TX-9)",http://en.wikipedia.org/wiki/Al_Green_(politician)M001157,"Rep. Michael T. McCaul (R, TX-10)",http://en.wikipedia.org/wiki/Michael_McCaulC001062,"Rep. K. Michael Conaway (R, TX-11)",http://en.wikipedia.org/wiki/Mike_ConawayM001158,"Rep. Kenny Marchant (R, TX-24)",http://en.wikipedia.org/wiki/Kenny_MarchantC001063,"Rep. Henry Cuellar (D, TX-28)",http://en.wikipedia.org/wiki/Henry_CuellarM001159,"Rep. Cathy McMorris Rodgers (R, WA-5)",http://en.wikipedia.org/wiki/Cathy_McMorris_RodgersR000578,"Rep. David G. Reichert (R, WA-8)",http://en.wikipedia.org/wiki/Dave_ReichertM001160,"Rep. Gwen Moore (D, WI-4)",http://en.wikipedia.org/wiki/Gwen_MooreM001163,"Rep. Doris O. Matsui (D, CA-6)",http://en.wikipedia.org/wiki/Doris_MatsuiC000542,"Sen. Daniel Coats (R, IN)",http://en.wikipedia.org/wiki/Dan_CoatsN000127,"Rep. Richard M. Nolan (D, MN-8)",http://en.wikipedia.org/wiki/Rick_NolanS001154,"Rep. Bill Shuster (R, PA-9)",http://en.wikipedia.org/wiki/Bill_ShusterS000937,"Rep. Steve Stockman (R, TX-36)",http://en.wikipedia.org/wiki/Steve_StockmanC001064,"Rep. John Campbell (R, CA-45)",http://en.wikipedia.org/wiki/John_B._T._Campbell_IIIS001165,"Rep. Albio Sires (D, NJ-8)",http://en.wikipedia.org/wiki/Albio_SiresM001166,"Rep. Jerry McNerney (D, CA-9)",http://en.wikipedia.org/wiki/Jerry_McNerneyM001165,"Rep. Kevin McCarthy (R, CA-23)",http://en.wikipedia.org/wiki/Kevin_McCarthy_(California_politician)L000564,"Rep. Doug Lamborn (R, CO-5)",http://en.wikipedia.org/wiki/Doug_LambornP000593,"Rep. Ed Perlmutter (D, CO-7)",http://en.wikipedia.org/wiki/Ed_PerlmutterC001069,"Rep. Joe Courtney (D, CT-2)",http://en.wikipedia.org/wiki/Joe_Courtney_(politician)M001169,"Sen. Christopher Murphy (D, CT)",http://en.wikipedia.org/wiki/Chris_Murphy_(politician)C001066,"Rep. Kathy Castor (D, FL-14)",http://en.wikipedia.org/wiki/Kathy_CastorB001260,"Rep. Vern Buchanan (R, FL-16)",http://en.wikipedia.org/wiki/Vern_BuchananJ000288,"Rep. Henry C. ""Hank"" Johnson Jr. (D, GA-4)",http://en.wikipedia.org/wiki/Hank_JohnsonH001042,"Sen. Mazie K. Hirono (D, HI)",http://en.wikipedia.org/wiki/Mazie_HironoR000580,"Rep. Peter J. Roskam (R, IL-6)",http://en.wikipedia.org/wiki/Peter_RoskamD000607,"Sen. Joe Donnelly (D, IN)",http://en.wikipedia.org/wiki/Joe_DonnellyB001259,"Rep. Bruce L. Braley (D, IA-1)",http://en.wikipedia.org/wiki/Bruce_BraleyL000565,"Rep. David Loebsack (D, IA-2)",http://en.wikipedia.org/wiki/David_LoebsackY000062,"Rep. John A. Yarmuth (D, KY-3)",http://en.wikipedia.org/wiki/John_YarmuthS001168,"Rep. John P. Sarbanes (D, MD-3)",http://en.wikipedia.org/wiki/John_SarbanesW000798,"Rep. Tim Walberg (R, MI-7)",http://en.wikipedia.org/wiki/Tim_WalbergW000799,"Rep. Timothy J. Walz (D, MN-1)",http://en.wikipedia.org/wiki/Tim_WalzE000288,"Rep. Keith Ellison (D, MN-5)",http://en.wikipedia.org/wiki/Keith_EllisonB001256,"Rep. Michele Bachmann (R, MN-6)",http://en.wikipedia.org/wiki/Michele_BachmannS001172,"Rep. Adrian Smith (R, NE-3)",http://en.wikipedia.org/wiki/Adrian_Smith_(politician)H001041,"Sen. Dean Heller (R, NV)",http://en.wikipedia.org/wiki/Dean_HellerS001170,"Rep. Carol Shea-Porter (D, NH-1)",http://en.wikipedia.org/wiki/Carol_Shea-PorterC001067,"Rep. Yvette D. Clarke (D, NY-9)",http://en.wikipedia.org/wiki/Yvette_ClarkeG000555,"Sen. Kirsten E. Gillibrand (D, NY)",http://en.wikipedia.org/wiki/Kirsten_GillibrandJ000289,"Rep. Jim Jordan (R, OH-4)",http://en.wikipedia.org/wiki/Jim_Jordan_(Ohio_politician)C001068,"Rep. Steve Cohen (D, TN-9)",http://en.wikipedia.org/wiki/Steve_CohenW000800,"Rep. Peter Welch (D, VT-0)",http://en.wikipedia.org/wiki/Peter_WelchK000367,"Sen. Amy Klobuchar (D, MN)",http://en.wikipedia.org/wiki/Amy_KlobucharM001170,"Sen. Claire McCaskill (D, MO)",http://en.wikipedia.org/wiki/Claire_McCaskillT000464,"Sen. Jon Tester (D, MT)",http://en.wikipedia.org/wiki/Jon_TesterC001070,"Sen. Robert P. Casey, Jr. (D, PA)","http://en.wikipedia.org/wiki/Bob_Casey,_Jr."W000802,"Sen. Sheldon Whitehouse (D, RI)",http://en.wikipedia.org/wiki/Sheldon_Whitehouse